{
  "artifact": "smoke-texture",
  "rows": [
    {
      "artifact": "smoke-texture",
      "count": 2,
      "mean": 6.769566999092048,
      "method": "Grid-PinkPEPS-smoke",
      "metric": "psnr",
      "profile": "course_fast",
      "run_id": "20260721T175141764666Z-smoke-texture-course_fast-s0-737949da",
      "schema": "peps.paper_artifact_summary",
      "schema_version": 1,
      "scope": "global",
      "unit": "dB"
    },
    {
      "artifact": "smoke-texture",
      "count": 2,
      "mean": 6.039834763811627,
      "method": "LPE-smoke",
      "metric": "psnr",
      "profile": "course_fast",
      "run_id": "20260721T175141764666Z-smoke-texture-course_fast-s0-737949da",
      "schema": "peps.paper_artifact_summary",
      "schema_version": 1,
      "scope": "global",
      "unit": "dB"
    },
    {
      "artifact": "smoke-texture",
      "count": 2,
      "mean": 6.22885053613204,
      "method": "NTC_N-smoke",
      "metric": "psnr",
      "profile": "course_fast",
      "run_id": "20260721T175141764666Z-smoke-texture-course_fast-s0-737949da",
      "schema": "peps.paper_artifact_summary",
      "schema_version": 1,
      "scope": "global",
      "unit": "dB"
    },
    {
      "artifact": "smoke-texture",
      "count": 1,
      "mean": 7.895543667426937,
      "method": "Grid-PinkPEPS-smoke",
      "metric": "psnr",
      "profile": "course_fast",
      "run_id": "20260721T175141764666Z-smoke-texture-course_fast-s0-737949da",
      "schema": "peps.paper_artifact_summary",
      "schema_version": 1,
      "scope": "semantic:DIFF",
      "unit": "dB"
    },
    {
      "artifact": "smoke-texture",
      "count": 1,
      "mean": 7.0015450338410155,
      "method": "LPE-smoke",
      "metric": "psnr",
      "profile": "course_fast",
      "run_id": "20260721T175141764666Z-smoke-texture-course_fast-s0-737949da",
      "schema": "peps.paper_artifact_summary",
      "schema_version": 1,
      "scope": "semantic:DIFF",
      "unit": "dB"
    },
    {
      "artifact": "smoke-texture",
      "count": 1,
      "mean": 5.902504854676518,
      "method": "NTC_N-smoke",
      "metric": "psnr",
      "profile": "course_fast",
      "run_id": "20260721T175141764666Z-smoke-texture-course_fast-s0-737949da",
      "schema": "peps.paper_artifact_summary",
      "schema_version": 1,
      "scope": "semantic:DIFF",
      "unit": "dB"
    },
    {
      "artifact": "smoke-texture",
      "count": 1,
      "mean": 5.64359033075716,
      "method": "Grid-PinkPEPS-smoke",
      "metric": "psnr",
      "profile": "course_fast",
      "run_id": "20260721T175141764666Z-smoke-texture-course_fast-s0-737949da",
      "schema": "peps.paper_artifact_summary",
      "schema_version": 1,
      "scope": "semantic:rough",
      "unit": "dB"
    },
    {
      "artifact": "smoke-texture",
      "count": 1,
      "mean": 5.078124493782239,
      "method": "LPE-smoke",
      "metric": "psnr",
      "profile": "course_fast",
      "run_id": "20260721T175141764666Z-smoke-texture-course_fast-s0-737949da",
      "schema": "peps.paper_artifact_summary",
      "schema_version": 1,
      "scope": "semantic:rough",
      "unit": "dB"
    },
    {
      "artifact": "smoke-texture",
      "count": 1,
      "mean": 6.55519621758756,
      "method": "NTC_N-smoke",
      "metric": "psnr",
      "profile": "course_fast",
      "run_id": "20260721T175141764666Z-smoke-texture-course_fast-s0-737949da",
      "schema": "peps.paper_artifact_summary",
      "schema_version": 1,
      "scope": "semantic:rough",
      "unit": "dB"
    }
  ],
  "run_id": "20260721T175141764666Z-smoke-texture-course_fast-s0-737949da",
  "schema": "peps.paper_artifact_summary",
  "schema_version": 1
}
