{
  "artifact": "smoke-image",
  "rows": [
    {
      "artifact": "smoke-image",
      "count": 1,
      "mean": 0.10018481913409749,
      "method": "G-PEPS-smoke",
      "metric": "lpsd",
      "profile": "course_fast",
      "run_id": "20260721T175053994434Z-smoke-image-course_fast-s0-3cfadfa6",
      "schema": "peps.paper_artifact_summary",
      "schema_version": 1,
      "scope": "global",
      "unit": ""
    },
    {
      "artifact": "smoke-image",
      "count": 1,
      "mean": 0.205733583804015,
      "method": "G-PEPS-smoke",
      "metric": "lsd",
      "profile": "course_fast",
      "run_id": "20260721T175053994434Z-smoke-image-course_fast-s0-3cfadfa6",
      "schema": "peps.paper_artifact_summary",
      "schema_version": 1,
      "scope": "global",
      "unit": ""
    },
    {
      "artifact": "smoke-image",
      "count": 1,
      "mean": 10.439540587533235,
      "method": "G-PEPS-smoke",
      "metric": "psnr",
      "profile": "course_fast",
      "run_id": "20260721T175053994434Z-smoke-image-course_fast-s0-3cfadfa6",
      "schema": "peps.paper_artifact_summary",
      "schema_version": 1,
      "scope": "global",
      "unit": "dB"
    },
    {
      "artifact": "smoke-image",
      "count": 1,
      "mean": 0.11839385779481147,
      "method": "Grid-smoke",
      "metric": "lpsd",
      "profile": "course_fast",
      "run_id": "20260721T175053994434Z-smoke-image-course_fast-s0-3cfadfa6",
      "schema": "peps.paper_artifact_summary",
      "schema_version": 1,
      "scope": "global",
      "unit": ""
    },
    {
      "artifact": "smoke-image",
      "count": 1,
      "mean": 0.20622604987606108,
      "method": "Grid-smoke",
      "metric": "lsd",
      "profile": "course_fast",
      "run_id": "20260721T175053994434Z-smoke-image-course_fast-s0-3cfadfa6",
      "schema": "peps.paper_artifact_summary",
      "schema_version": 1,
      "scope": "global",
      "unit": ""
    },
    {
      "artifact": "smoke-image",
      "count": 1,
      "mean": 10.262842387867936,
      "method": "Grid-smoke",
      "metric": "psnr",
      "profile": "course_fast",
      "run_id": "20260721T175053994434Z-smoke-image-course_fast-s0-3cfadfa6",
      "schema": "peps.paper_artifact_summary",
      "schema_version": 1,
      "scope": "global",
      "unit": "dB"
    },
    {
      "artifact": "smoke-image",
      "count": 1,
      "mean": 0.09291824557495061,
      "method": "LPE-smoke",
      "metric": "lpsd",
      "profile": "course_fast",
      "run_id": "20260721T175053994434Z-smoke-image-course_fast-s0-3cfadfa6",
      "schema": "peps.paper_artifact_summary",
      "schema_version": 1,
      "scope": "global",
      "unit": ""
    },
    {
      "artifact": "smoke-image",
      "count": 1,
      "mean": 0.20513925728346882,
      "method": "LPE-smoke",
      "metric": "lsd",
      "profile": "course_fast",
      "run_id": "20260721T175053994434Z-smoke-image-course_fast-s0-3cfadfa6",
      "schema": "peps.paper_artifact_summary",
      "schema_version": 1,
      "scope": "global",
      "unit": ""
    },
    {
      "artifact": "smoke-image",
      "count": 1,
      "mean": 10.488245478724561,
      "method": "LPE-smoke",
      "metric": "psnr",
      "profile": "course_fast",
      "run_id": "20260721T175053994434Z-smoke-image-course_fast-s0-3cfadfa6",
      "schema": "peps.paper_artifact_summary",
      "schema_version": 1,
      "scope": "global",
      "unit": "dB"
    }
  ],
  "run_id": "20260721T175053994434Z-smoke-image-course_fast-s0-3cfadfa6",
  "schema": "peps.paper_artifact_summary",
  "schema_version": 1
}
